"","options"
"2186","cherries, sweet, canned, light syrup pack, solids and liquids"
"2187","cherries, sweet, canned, pitted, heavy syrup pack, solids and liquids"
"2188","cherries, sweet, canned, extra heavy syrup pack, solids and liquids"
"2189","cherries, sweet, frozen, sweetened"
"2190","crabapples, raw"
"2191","cranberries, raw"
"2192","cranberries, dried, sweetened"
"2193","cranberry sauce, canned, sweetened"
"2194","cranberry-orange relish, canned"
"2195","currants, european black, raw"
"2196","currants, red and white, raw"
"2197","currants, zante, dried"
"2198","custard-apple, (bullock's-heart), raw"
"2199","dates, deglet noor"
"2200","elderberries, raw"
"2201","figs, raw"
"2202","figs, canned, water pack, solids and liquids"
"2203","figs, canned, light syrup pack, solids and liquids"
"2204","figs, canned, heavy syrup pack, solids and liquids"
"2205","figs, canned, extra heavy syrup pack, solids and liquids"
"2206","figs, dried, uncooked"
"2207","figs, dried, stewed"
"2208","fruit cocktail, (peach and pineapple and pear and grape and cherry), canned, water pack, solids and liquids"
"2209","fruit cocktail, (peach and pineapple and pear and grape and cherry), canned, juice pack, solids and liquids"
"2210","fruit cocktail, (peach and pineapple and pear and grape and cherry), canned, extra light syrup, solids and liquids"
"2211","fruit cocktail, (peach and pineapple and pear and grape and cherry), canned, light syrup, solids and liquids"
"2212","fruit cocktail, (peach and pineapple and pear and grape and cherry), canned, heavy syrup, solids and liquids"
"2213","fruit cocktail, (peach and pineapple and pear and grape and cherry), canned, extra heavy syrup, solids and liquids"
"2214","fruit salad, (peach and pear and apricot and pineapple and cherry), canned, water pack, solids and liquids"
"2215","fruit salad, (peach and pear and apricot and pineapple and cherry), canned, juice pack, solids and liquids"
"2216","fruit salad, (peach and pear and apricot and pineapple and cherry), canned, light syrup, solids and liquids"
"2217","fruit salad, (peach and pear and apricot and pineapple and cherry), canned, heavy syrup, solids and liquids"
"2218","fruit salad, (peach and pear and apricot and pineapple and cherry), canned, extra heavy syrup, solids and liquids"
"2219","gooseberries, raw"
"2220","gooseberries, canned, light syrup pack, solids and liquids"
"2221","goji berries, dried"
"2222","grapefruit, raw, pink and red and white, all areas"
"2223","grapefruit, raw, pink and red, all areas"
"2224","grapefruit, raw, pink and red, california and arizona"
"2225","grapefruit, raw, pink and red, florida"
"2226","grapefruit, raw, white, all areas"
"2227","grapefruit, raw, white, california"
"2228","grapefruit, raw, white, florida"
"2229","grapefruit, sections, canned, water pack, solids and liquids"
"2230","grapefruit, sections, canned, juice pack, solids and liquids"
"2231","grapefruit, sections, canned, light syrup pack, solids and liquids"
"2232","grapefruit juice, white, canned or bottled, unsweetened"
"2233","grapefruit juice, white, canned, sweetened"
"2234","grapefruit juice, white, frozen concentrate, unsweetened, undiluted"
"2235","grapefruit juice, white, frozen concentrate, unsweetened, diluted with 3 volume water"
"2236","grapefruit juice, pink or red, with added calcium"
"2237","grapefruit juice, white, raw"
"2238","grapes, muscadine, raw"
"2239","grape juice, canned or bottled, unsweetened, with added ascorbic acid"
"2240","grapes, american type (slip skin), raw"
"2241","grapes, red or green (european type, such as thompson seedless), raw"
"2242","grapes, canned, thompson seedless, water pack, solids and liquids"
"2243","grapes, canned, thompson seedless, heavy syrup pack, solids and liquids"
"2244","grape juice, canned or bottled, unsweetened, without added ascorbic acid"
"2245","groundcherries, (cape-gooseberries or poha), raw"
"2246","guavas, common, raw"
"2247","guavas, strawberry, raw"
"2248","guava sauce, cooked"
"2249","jackfruit, raw"
"2250","java-plum, (jambolan), raw"
"2251","jujube, raw"
"2252","jujube, chinese, fresh, dried"
"2253","kiwifruit, green, raw"
"2254","kumquats, raw"
"2255","lemons, raw, without peel"
"2256","lemon juice, raw"
"2257","lemon juice from concentrate, canned or bottled"
"2258","lemon juice, frozen, unsweetened, single strength"
"2259","lemon peel, raw"
"2260","limes, raw"
"2261","lime juice, raw"
"2262","lime juice, canned or bottled, unsweetened"
"2263","blueberries, dried, sweetened"
"2264","litchis, raw"
"2265","litchis, dried"
"2266","loganberries, frozen"
"2267","longans, raw"
"2268","longans, dried"
"2269","loquats, raw"
"2270","mammy-apple, (mamey), raw"
"2271","mangos, raw"
"2272","mangosteen, canned, syrup pack"
"2273","mango, dried, sweetened"
"2274","melons, cantaloupe, raw"
"2275","melons, casaba, raw"
"2276","melons, honeydew, raw"
"2277","melon balls, frozen"
"2278","mulberries, raw"
"2279","nectarines, raw"
"2280","oheloberries, raw"
"2281","olives, ripe, canned (small-extra large)"
"2282","olives, ripe, canned (jumbo-super colossal)"
"2283","olives, pickled, canned or bottled, green"
"2284","oranges, raw, all commercial varieties"
"2285","oranges, raw, california, valencias"
"2286","oranges, raw, navels"
"2287","oranges, raw, florida"
"2288","oranges, raw, with peel"
"2289","orange juice, raw"
"2290","orange juice, canned, unsweetened"
"2291","orange juice, chilled, includes from concentrate"
"2292","orange juice, chilled, includes from concentrate, with added calcium and vitamin d"
"2293","orange juice, chilled, includes from concentrate, with added calcium"
"2294","orange juice, frozen concentrate, unsweetened, diluted with 3 volume water, with added calcium"
"2295","orange juice, frozen concentrate, unsweetened, undiluted, with added calcium"
"2296","orange juice, frozen concentrate, unsweetened, undiluted"
"2297","orange juice, frozen concentrate, unsweetened, diluted with 3 volume water"
"2298","orange peel, raw"
"2299","orange-grapefruit juice, canned or bottled, unsweetened"
"2300","tangerines, (mandarin oranges), raw"
"2301","tangerines, (mandarin oranges), canned, juice pack"
"2302","tangerines, (mandarin oranges), canned, light syrup pack"
"2303","tangerine juice, raw"
"2304","tangerine juice, canned, sweetened"
"2305","papayas, raw"
"2306","papaya, canned, heavy syrup, drained"
"2307","papaya nectar, canned"
"2308","passion-fruit, (granadilla), purple, raw"
"2309","passion-fruit juice, purple, raw"
"2310","passion-fruit juice, yellow, raw"
"2311","peaches, yellow, raw"
"2312","peaches, canned, water pack, solids and liquids"
"2313","peaches, canned, juice pack, solids and liquids"
"2314","peaches, canned, extra light syrup, solids and liquids"
"2315","peaches, canned, light syrup pack, solids and liquids"
"2316","peaches, canned, heavy syrup pack, solids and liquids"
"2317","peaches, canned, extra heavy syrup pack, solids and liquids"
"2318","peaches, spiced, canned, heavy syrup pack, solids and liquids"
"2319","peaches, dehydrated (low-moisture), sulfured, uncooked"
"2320","peaches, dehydrated (low-moisture), sulfured, stewed"
"2321","peaches, dried, sulfured, uncooked"
"2322","peaches, dried, sulfured, stewed, without added sugar"
"2323","peaches, dried, sulfured, stewed, with added sugar"
"2324","peaches, frozen, sliced, sweetened"
"2325","peach nectar, canned, without added ascorbic acid"
"2326","pears, raw"
"2327","pears, canned, water pack, solids and liquids"
"2328","pears, canned, juice pack, solids and liquids"
"2329","pears, canned, extra light syrup pack, solids and liquids"
"2330","pears, canned, light syrup pack, solids and liquids"
"2331","pears, canned, heavy syrup pack, solids and liquids"
"2332","pears, canned, extra heavy syrup pack, solids and liquids"
"2333","pears, dried, sulfured, uncooked"
"2334","pears, dried, sulfured, stewed, without added sugar"
"2335","pears, dried, sulfured, stewed, with added sugar"
"2336","pear nectar, canned, without added ascorbic acid"
"2337","persimmons, japanese, raw"
"2338","persimmons, japanese, dried"
"2339","persimmons, native, raw"
"2340","pineapple, raw, all varieties"
"2341","pineapple, canned, water pack, solids and liquids"
"2342","pineapple, canned, juice pack, solids and liquids"
"2343","pineapple, canned, light syrup pack, solids and liquids"
"2344","pineapple, canned, heavy syrup pack, solids and liquids"
"2345","pineapple, canned, extra heavy syrup pack, solids and liquids"
"2346","pineapple, frozen, chunks, sweetened"
"2347","pineapple juice, canned or bottled, unsweetened, without added ascorbic acid"
"2348","pineapple juice, frozen concentrate, unsweetened, undiluted"
"2349","pineapple juice, frozen concentrate, unsweetened, diluted with 3 volume water"
"2350","pitanga, (surinam-cherry), raw"
"2351","plantains, raw"
"2352","plantains, cooked"
"2353","plums, raw"
"2354","plums, canned, purple, water pack, solids and liquids"
"2355","plums, canned, purple, juice pack, solids and liquids"
"2356","plums, canned, purple, light syrup pack, solids and liquids"
"2357","plums, canned, purple, heavy syrup pack, solids and liquids"
"2358","plums, canned, purple, extra heavy syrup pack, solids and liquids"
"2359","pomegranates, raw"
"2360","prickly pears, raw"
"2361","prunes, canned, heavy syrup pack, solids and liquids"
"2362","prunes, dehydrated (low-moisture), uncooked"
"2363","prunes, dehydrated (low-moisture), stewed"
"2364","plums, dried (prunes), uncooked"
"2365","plums, dried (prunes), stewed, without added sugar"
"2366","plums, dried (prunes), stewed, with added sugar"
"2367","prune juice, canned"
"2368","pummelo, raw"
"2369","quinces, raw"
"2370","raisins, golden seedless"
"2371","raisins, seedless"
"2372","raisins, seeded"
"2373","rambutan, canned, syrup pack"
"2374","raspberries, raw"
"2375","raspberries, canned, red, heavy syrup pack, solids and liquids"
"2376","raspberries, frozen, red, sweetened"
"2377","rhubarb, raw"
"2378","rhubarb, frozen, uncooked"
"2379","rhubarb, frozen, cooked, with sugar"
"2380","roselle, raw"
"2381","rose-apples, raw"
"2382","sapodilla, raw"
"2383","sapote, mamey, raw"
"2384","soursop, raw"
"2385","strawberries, raw"
"2386","strawberries, canned, heavy syrup pack, solids and liquids"
"2387","strawberries, frozen, unsweetened"
"2388","strawberries, frozen, sweetened, whole"
"2389","strawberries, frozen, sweetened, sliced"
"2390","sugar-apples, (sweetsop), raw"
"2391","tamarinds, raw"
"2392","fruit salad, (pineapple and papaya and banana and guava), tropical, canned, heavy syrup, solids and liquids"
"2393","watermelon, raw"
"2394","maraschino cherries, canned, drained"
"2395","feijoa, raw"
"2396","pears, asian, raw"
"2397","fruit cocktail, canned, heavy syrup, drained"
"2398","blueberries, canned, light syrup, drained"
"2399","blueberries, wild, canned, heavy syrup, drained"
"2400","pineapple, canned, juice pack, drained"
"2401","apricots, canned, heavy syrup, drained"
"2402","cherries, sour, canned, water pack, drained"
"2403","cherries, sweet, canned, pitted, heavy syrup, drained"
"2404","peaches, canned, heavy syrup, drained"
"2405","pears, canned, heavy syrup, drained"
"2406","plums, canned, heavy syrup, drained"
"2407","tangerines, (mandarin oranges), canned, juice pack, drained"
"2408","apple juice, canned or bottled, unsweetened, with added ascorbic acid"
"2409","applesauce, canned, unsweetened, with added ascorbic acid"
"2410","applesauce, canned, sweetened, with salt"
"2411","apricot nectar, canned, with added ascorbic acid"
"2412","grapefruit juice, pink, raw"
"2413","peach nectar, canned, with added ascorbic acid"
"2414","pear nectar, canned, with added ascorbic acid"
"2415","pineapple juice, canned or bottled, unsweetened, with added ascorbic acid"
"2416","apple juice, frozen concentrate, unsweetened, undiluted, with added ascorbic acid"
"2417","apple juice, frozen concentrate, unsweetened, diluted with 3 volume water, with added ascorbic acid"
"2418","pears, raw, bartlett"
"2419","pears, raw, red anjou"
"2420","pears, raw, bosc"
"2421","pears, raw, green anjou"
"2422","grapefruit juice, white, bottled, unsweetened, ocean spray"
"2423","jackfruit, canned, syrup pack"
"2424","dates, medjool"
"2425","durian, raw or frozen"
"2426","prune puree"
"2427","candied fruit"
"2428","abiyuch, raw"
"2429","rowal, raw"
"2430","pineapple, raw, traditional varieties"
"2431","pineapple, raw, extra sweet variety"
"2432","usda commodity, mixed fruit (peaches, pears, grapes), canned, light syrup, drained"
"2433","usda commodity, mixed fruit (peaches, pears, grapes), canned, light syrup, solids and liquids"
"2434","clementines, raw"
"2435","guanabana nectar, canned"
"2436","guava nectar, canned, with added ascorbic acid"
"2437","mango nectar, canned"
"2438","tamarind nectar, canned"
"2439","usda commodity peaches, canned, light syrup, drained"
"2440","usda commodity pears, canned, juice pack, drained"
"2441","usda commodity pears, canned, light syrup, drained"
"2442","pomegranate juice, bottled"
"2443","juice, apple and grape blend, with added ascorbic acid"
"2444","juice, apple, grape and pear blend, with added ascorbic acid and calcium"
"2445","plantains, green, fried"
"2446","plantains, yellow, fried, latino restaurant"
"2447","nance, canned, syrup, drained"
"2448","nance, frozen, unsweetened"
"2449","naranjilla (lulo) pulp, frozen, unsweetened"
"2450","horned melon (kiwano)"
"2451","orange pineapple juice blend"
"2452","apples, raw, red delicious, with skin"
"2453","apples, raw, golden delicious, with skin"
"2454","apples, raw, granny smith, with skin"
"2455","apples, raw, gala, with skin"
"2456","apples, raw, fuji, with skin"
"2457","orange juice, chilled, includes from concentrate, with added calcium and vitamins a, d, e"
"2458","fruit juice smoothie, naked juice, mighty mango"
"2459","fruit juice smoothie, naked juice, green machine"
"2460","pineapple juice, canned, not from concentrate, unsweetened, with added vitamins a, c and e"
"2461","fruit juice smoothie, naked juice, blue machine"
"2462","grape juice, canned or bottled, unsweetened, with added ascorbic acid and calcium"
"2463","fruit juice smoothie, odwalla, original superfood"
"2464","fruit juice smoothie, bolthouse farms, berry boost"
"2465","fruit juice smoothie, bolthouse farms, green goodness"
"2466","fruit juice smoothie, bolthouse farms, strawberry banana"
"2467","apple juice, canned or bottled, unsweetened, with added ascorbic acid, calcium, and potassium"
"2468","raspberries, frozen, unsweetened"
"2469","guava nectar, with sucralose, canned"
"2470","kiwifruit, zespri sungold, raw"
"2471","cranberry juice blend, 100% juice, bottled, with added vitamin c and calcium"
"2472","lemon juice from concentrate, bottled, concord"
"2473","lemon juice from concentrate, bottled, real lemon"
"2474","cranberry sauce, whole, canned, ocean spray"
"2475","cranberry sauce, jellied, canned, ocean spray"
"2476","ruby red grapefruit juice blend (grapefruit, grape, apple), ocean spray, bottled, with added vitamin c"
"2477","fruit juice smoothie, odwalla, strawberry banana"
"2478","fruit juice smoothie, naked juice, strawberry banana"
"2479","pork, fresh, composite of separable fat, with added solution, cooked"
"2480","pork, fresh, carcass, separable lean and fat, raw"
"2481","pork, fresh, composite of trimmed retail cuts (leg, loin, shoulder), separable lean only, raw"
"2482","pork, fresh, composite of trimmed leg, loin, shoulder, and spareribs, (includes cuts to be cured), separable lean and fat, raw"
"2483","pork, fresh, backfat, raw"
"2484","pork, fresh, belly, raw"
"2485","pork, fresh, separable fat, raw"
"2486","pork, fresh, separable fat, cooked"
"2487","pork, fresh, leg (ham), whole, separable lean and fat, raw"
"2488","pork, fresh, leg (ham), whole, separable lean and fat, cooked, roasted"
"2489","pork, fresh, leg (ham), whole, separable lean only, raw"
"2490","pork, fresh, leg (ham), whole, separable lean only, cooked, roasted"
"2491","pork, fresh, leg (ham), rump half, separable lean and fat, raw"
"2492","pork, fresh, leg (ham), rump half, separable lean and fat, cooked, roasted"
"2493","pork, fresh, leg (ham), rump half, separable lean only, raw"
"2494","pork, fresh, leg (ham), rump half, separable lean only, cooked, roasted"
"2495","pork, fresh, leg (ham), shank half, separable lean and fat, raw"
"2496","pork, fresh, leg (ham), shank half, separable lean and fat, cooked, roasted"
"2497","pork, fresh, leg (ham), shank half, separable lean only, raw"
"2498","pork, fresh, leg (ham), shank half, separable lean only, cooked, roasted"
"2499","pork, fresh, loin, whole, separable lean and fat, raw"
"2500","pork, fresh, loin, whole, separable lean and fat, cooked, braised"
"2501","pork, fresh, loin, whole, separable lean and fat, cooked, broiled"
"2502","pork, fresh, loin, whole, separable lean and fat, cooked, roasted"
"2503","pork, fresh, loin, whole, separable lean only, raw"
"2504","pork, fresh, loin, whole, separable lean only, cooked, braised"
"2505","pork, fresh, loin, whole, separable lean only, cooked, broiled"
"2506","pork, fresh, loin, whole, separable lean only, cooked, roasted"
"2507","pork, fresh, loin, blade (chops or roasts), bone-in, separable lean and fat, raw"
"2508","pork, fresh, loin, blade (chops), bone-in, separable lean and fat, cooked, braised"
"2509","pork, fresh, loin, blade (chops), bone-in, separable lean and fat, cooked, broiled"
"2510","pork, fresh, loin, blade (roasts), bone-in, separable lean and fat, cooked, roasted"
"2511","pork, fresh, loin, blade (chops or roasts), bone-in, separable lean only, raw"
"2512","pork, fresh, loin, blade (chops), bone-in, separable lean only, cooked, braised"
"2513","pork, fresh, loin, blade (chops), bone-in, separable lean only, cooked, broiled"
"2514","pork, fresh, loin, blade (roasts), bone-in, separable lean only, cooked, roasted"
"2515","pork, fresh, loin, center loin (chops), bone-in, separable lean and fat, raw"
"2516","pork, fresh, loin, center loin (chops), bone-in, separable lean and fat, cooked, braised"
"2517","pork, fresh, loin, center loin (chops), bone-in, separable lean and fat, cooked, broiled"
"2518","pork, fresh, loin, center loin (roasts), bone-in, separable lean and fat, cooked, roasted"
"2519","pork, fresh, loin, center loin (chops), bone-in, separable lean only, raw"
"2520","pork, fresh, loin, center loin (chops), bone-in, separable lean only, cooked, braised"
"2521","pork, fresh, loin, center loin (chops), bone-in, separable lean only, cooked, broiled"
"2522","pork, fresh, loin, center loin (roasts), bone-in, separable lean only, cooked, roasted"
"2523","pork, fresh, loin, center rib (chops or roasts), bone-in, separable lean and fat, raw"
"2524","pork, fresh, loin, center rib (chops), bone-in, separable lean and fat, cooked, braised"
"2525","pork, fresh, loin, center rib (chops), bone-in, separable lean and fat, cooked, broiled"
"2526","pork, fresh, loin, center rib (roasts), bone-in, separable lean and fat, cooked, roasted"
"2527","pork, fresh, loin, center rib (chops or roasts), bone-in, separable lean only, raw"
"2528","pork, fresh, loin, center rib (chops), bone-in, separable lean only, cooked, braised"
"2529","pork, fresh, loin, center rib (chops), bone-in, separable lean only, cooked, broiled"
"2530","pork, fresh, loin, center rib (roasts), bone-in, separable lean only, cooked, roasted"
"2531","pork, fresh, loin, sirloin (chops or roasts), bone-in, separable lean and fat, raw"
"2532","pork, fresh, loin, sirloin (chops), bone-in, separable lean and fat, cooked, braised"
"2533","pork, fresh, loin, sirloin (chops), bone-in, separable lean and fat, cooked, broiled"
"2534","pork, fresh, loin, sirloin (roasts), bone-in, separable lean and fat, cooked, roasted"
"2535","pork, fresh, loin, sirloin (chops or roasts), bone-in, separable lean only, raw"
"2536","pork, fresh, loin, sirloin (chops), bone-in, separable lean only, cooked, braised"
"2537","pork, fresh, loin, sirloin (chops), bone-in, separable lean only, cooked, broiled"
"2538","pork, fresh, loin, sirloin (roasts), bone-in, separable lean only, cooked, roasted"
"2539","pork, fresh, loin, tenderloin, separable lean only, raw"
"2540","pork, fresh, loin, tenderloin, separable lean only, cooked, roasted"
"2541","pork, fresh, loin, top loin (chops), boneless, separable lean and fat, raw"
"2542","pork, fresh, loin, top loin (chops), boneless, separable lean and fat, cooked, braised"
"2543","pork, fresh, loin, top loin (chops), boneless, separable lean and fat, cooked, broiled"
"2544","pork, fresh, loin, top loin (roasts), boneless, separable lean and fat, cooked, roasted"
"2545","pork, fresh, loin, top loin (chops), boneless, separable lean only, raw"
"2546","pork, fresh, loin, top loin (chops), boneless, separable lean only, cooked, braised"
"2547","pork, fresh, loin, top loin (chops), boneless, separable lean only, cooked, broiled"
"2548","pork, fresh, loin, top loin (roasts), boneless, separable lean only, cooked, roasted"
"2549","pork, fresh, shoulder, whole, separable lean and fat, raw"
"2550","pork, fresh, shoulder, whole, separable lean and fat, cooked, roasted"
"2551","pork, fresh, shoulder, whole, separable lean only, raw"
"2552","pork, fresh, shoulder, whole, separable lean only, cooked, roasted"
"2553","pork, fresh, shoulder, arm picnic, separable lean and fat, raw"
"2554","pork, fresh, shoulder, arm picnic, separable lean and fat, cooked, braised"
"2555","pork, fresh, shoulder, arm picnic, separable lean and fat, cooked, roasted"
"2556","pork, fresh, shoulder, arm picnic, separable lean only, raw"
"2557","pork, fresh, shoulder, arm picnic, separable lean only, cooked, braised"
"2558","pork, fresh, shoulder, arm picnic, separable lean only, cooked, roasted"
"2559","pork, fresh, shoulder, (boston butt), blade (steaks), separable lean and fat, raw"
"2560","pork, fresh, shoulder, (boston butt), blade (steaks), separable lean and fat, cooked, braised"
"2561","pork, fresh, shoulder, blade, boston (steaks), separable lean and fat, cooked, broiled"
"2562","pork, fresh, shoulder, blade, boston (roasts), separable lean and fat, cooked, roasted"
"2563","pork, fresh, shoulder, (boston butt), blade (steaks), separable lean only, raw"
"2564","pork, fresh, shoulder, (boston butt), blade (steaks), separable lean only, cooked, braised"
"2565","pork, fresh, shoulder, blade, boston (steaks), separable lean only, cooked, broiled"
"2566","pork, fresh, shoulder, blade, boston (roasts), separable lean only, cooked, roasted"
"2567","pork, fresh, spareribs, separable lean and fat, raw"
"2568","pork, fresh, spareribs, separable lean and fat, cooked, braised"
"2569","pork, fresh, composite of trimmed retail cuts (leg, loin, and shoulder), separable lean only, cooked"
"2570","pork, fresh, loin, center loin (chops), boneless, separable lean only, raw"
"2571","pork, fresh, variety meats and by-products, brain, raw"
"2572","pork, fresh, variety meats and by-products, brain, cooked, braised"
"2573","pork, fresh, variety meats and by-products, chitterlings, raw"
"2574","pork, fresh, variety meats and by-products, chitterlings, cooked, simmered"
"2575","pork, fresh, variety meats and by-products, ears, frozen, raw"
"2576","pork, fresh, variety meats and by-products, ears, frozen, cooked, simmered"
"2577","pork, fresh, variety meats and by-products, feet, raw"
"2578","pork, fresh, variety meats and by-products, heart, raw"
"2579","pork, fresh, variety meats and by-products, heart, cooked, braised"
"2580","pork, fresh, variety meats and by-products, jowl, raw"
"2581","pork, fresh, variety meats and by-products, kidneys, raw"
"2582","pork, fresh, variety meats and by-products, kidneys, cooked, braised"
"2583","pork, fresh, variety meats and by-products, leaf fat, raw"
"2584","pork, fresh, variety meats and by-products, liver, raw"
"2585","pork, fresh, variety meats and by-products, liver, cooked, braised"
"2586","pork, fresh, variety meats and by-products, lungs, raw"
"2587","pork, fresh, variety meats and by-products, lungs, cooked, braised"
"2588","pork, fresh, variety meats and by-products, mechanically separated, raw"
"2589","pork, fresh, variety meats and by-products, pancreas, raw"
"2590","pork, fresh, variety meats and by-products, pancreas, cooked, braised"
"2591","pork, fresh, variety meats and by-products, spleen, raw"
"2592","pork, fresh, variety meats and by-products, spleen, cooked, braised"
"2593","pork, fresh, variety meats and by-products, stomach, raw"
"2594","pork, fresh, loin, blade (chops), bone-in, separable lean only, cooked, pan-fried"
"2595","pork, fresh, variety meats and by-products, tongue, raw"
"2596","pork, fresh, variety meats and by-products, tongue, cooked, braised"
"2597","pork, cured, bacon, unprepared"
"2598","pork, cured, breakfast strips, raw or unheated"
"2599","canadian bacon, unprepared"
"2600","pork, cured, feet, pickled"
"2601","pork, cured, ham, boneless, extra lean (approximately 5% fat), roasted"
"2602","pork, cured, ham, boneless, regular (approximately 11% fat), roasted"
"2603","pork, cured, ham, extra lean (approximately 4% fat), canned, unheated"
"2604","pork, cured, ham, extra lean (approximately 4% fat), canned, roasted"
"2605","pork, cured, ham, regular (approximately 13% fat), canned, roasted"
"2606","pork, cured, ham, center slice, country-style, separable lean only, raw"
"2607","pork, cured, ham, center slice, separable lean and fat, unheated"
"2608","pork, cured, ham, patties, unheated"
"2609","pork, cured, ham, steak, boneless, extra lean, unheated"
"2610","pork, cured, ham, whole, separable lean and fat, unheated"
"2611","pork, cured, ham, whole, separable lean only, unheated"
"2612","pork, cured, ham, whole, separable lean only, roasted"
"2613","usda commodity, pork, canned"
"2614","pork, fresh, loin, center loin (chops), boneless, separable lean only, cooked, pan-broiled"
"2615","pork, fresh, loin, center loin (chops), boneless, separable lean and fat, raw"
"2616","pork, cured, salt pork, raw"
