"","options"
"6642","millet flour"
"6643","sorghum flour, whole-grain"
"6644","wheat flour, whole-grain, soft wheat"
"6645","sorghum flour, refined, unenriched"
"6646","rice, brown, parboiled, cooked, uncle bens"
"6647","pasta, whole grain, 51% whole wheat, remaining enriched semolina, cooked"
"6648","pasta, whole grain, 51% whole wheat, remaining enriched semolina, dry"
"6649","pasta, gluten-free, brown rice flour, cooked, tinkyada"
"6650","pasta, gluten-free, corn flour and quinoa flour, cooked, ancient harvest"
"6651","pasta, gluten-free, rice flour and rice bran extract, cooked, de boles"
"6652","pasta, gluten-free, corn and rice flour, cooked"
"6653","fast foods, biscuit, with egg"
"6654","fast foods, biscuit, with egg and bacon"
"6655","fast foods, biscuit, with egg and ham"
"6656","fast foods, biscuit, with egg and sausage"
"6657","fast foods, biscuit with egg and steak"
"6658","fast foods, biscuit, with egg, cheese, and bacon"
"6659","fast foods, biscuit, with ham"
"6660","fast foods, biscuit, with sausage"
"6661","fast foods, biscuit, with crispy chicken fillet"
"6662","fast foods, croissant, with egg and cheese"
"6663","fast foods, croissant, with egg, cheese, and bacon"
"6664","fast foods, croissant, with egg, cheese, and ham"
"6665","fast foods, croissant, with egg, cheese, and sausage"
"6666","fast foods, egg, scrambled"
"6667","fast foods, english muffin, with cheese and sausage"
"6668","fast foods, english muffin, with egg, cheese, and canadian bacon"
"6669","fast foods, english muffin, with egg, cheese, and sausage"
"6670","fast foods, french toast with butter"
"6671","fast foods, french toast sticks"
"6672","fast foods, potatoes, hash browns, round pieces or patty"
"6673","fast foods, vanilla, light, soft-serve ice cream, with cone"
"6674","fast foods, sundae, caramel"
"6675","fast foods, sundae, hot fudge"
"6676","fast foods, sundae, strawberry"
"6677","fast foods, shrimp, breaded and fried"
"6678","fast foods, burrito, with beans"
"6679","fast foods, burrito, with beans and cheese"
"6680","fast foods, burrito, with beans and beef"
"6681","fast foods, burrito, with beans, cheese, and beef"
"6682","fast foods, nachos, with cheese"
"6683","fast foods, nachos, with cheese, beans, ground beef, and tomatoes"
"6684","fast foods, taco with beef, cheese and lettuce, hard shell"
"6685","fast foods, taco salad"
"6686","fast foods, cheeseburger; single, regular patty; plain"
"6687","fast foods, cheeseburger; single, regular patty, with condiments"
"6688","fast foods, cheeseburger; single, regular patty, with condiments and vegetables"
"6689","fast foods, cheeseburger; double, regular patty; plain"
"6690","fast foods, cheeseburger; double, regular patty, with condiments and vegetables"
"6691","fast foods, cheeseburger, double, regular patty and bun, with condiments"
"6692","fast foods, cheeseburger; double, regular, patty and bun; with condiments and vegetables"
"6693","fast foods, cheeseburger; single, large patty; plain"
"6694","fast foods, cheeseburger; single, large patty; with condiments and bacon"
"6695","fast foods, cheeseburger; single, large patty; with condiments and vegetables"
"6696","fast foods, cheeseburger; single, large patty; with condiments, vegetables and ham"
"6697","fast foods, cheeseburger; double, large patty, with condiments and vegetables"
"6698","fast foods, cheeseburger; triple, regular patty; plain"
"6699","fast foods, chicken fillet sandwich, plain with pickles"
"6700","fast foods, fish sandwich, with tartar sauce"
"6701","fast foods, fish sandwich, with tartar sauce and cheese"
"6702","fast foods, hamburger; single, regular patty; plain"
"6703","fast foods, hamburger; single, regular patty; with condiments"
"6704","fast foods, hamburger; single, regular patty; with condiments and vegetables"
"6705","fast foods, hamburger; double, regular, patty; plain"
"6706","fast foods, hamburger; double, regular patty; with condiments"
"6707","fast foods, hamburger; single, large patty; plain"
"6708","fast foods, hamburger; single, large patty; with condiments and vegetables"
"6709","fast foods, hamburger; double, large patty; with condiments and vegetables"
"6710","fast foods, hamburger, large, triple patty, with condiments"
"6711","fast foods, hotdog, plain"
"6712","fast foods, hotdog, with chili"
"6713","fast foods, hotdog, with corn flour coating (corndog)"
"6714","fast foods, roast beef sandwich, plain"
"6715","fast foods, submarine sandwich, cold cut on white bread with lettuce and tomato"
"6716","fast foods, submarine sandwich, roast beef on white bread with lettuce and tomato"
"6717","fast foods, submarine sandwich, tuna on white bread with lettuce and tomato"
"6718","fast foods, coleslaw"
"6719","fast foods, hush puppies"
"6720","fast foods, onion rings, breaded and fried"
"6721","fast foods, potato, french fried in vegetable oil"
"6722","fast foods, potato, mashed"
"6723","side dishes, potato salad"
"6724","burger king, vanilla shake"
"6725","fast food, biscuit"
"6726","chick-fil-a, chick-n-strips"
"6727","chick-fil-a, hash browns"
"6728","school lunch, pizza, big daddy's ls 16"" 51% whole grain rolled edge cheese pizza, frozen"
"6729","school lunch, pizza, big daddy's ls 16"" 51% whole grain rolled edge turkey pepperoni pizza, frozen"
"6730","school lunch, pizza, tony's smartpizza whole grain 4x6 cheese pizza 50/50 cheese, frozen"
"6731","school lunch, pizza, tony's smartpizza whole grain 4x6 pepperoni pizza 50/50 cheese, frozen"
"6732","school lunch, pizza, tony's breakfast pizza sausage, frozen"
"6733","subway, sweet onion chicken teriyaki sub on white bread with lettuce, tomato and sweet onion sauce"
"6734","fast foods, submarine sandwich, sweet onion chicken teriyaki on white bread with lettuce, tomato and sweet onion sauce"
"6735","subway, subway club sub on white bread with lettuce and tomato"
"6736","fast foods, submarine sandwich, turkey, roast beef and ham on white bread with lettuce and tomato"
"6737","fast foods, submarine sandwich, oven roasted chicken on white bread with lettuce and tomato"
"6738","fast foods, submarine sandwich, turkey breast on white bread with lettuce and tomato"
"6739","fast foods, submarine sandwich, ham on white bread with lettuce and tomato"
"6740","subway, meatball marinara sub on white bread (no toppings)"
"6741","fast foods, submarine sandwich, meatball marinara on white bread"
"6742","subway, steak & cheese sub on white bread with american cheese, lettuce and tomato"
"6743","fast foods, submarine sandwich, steak and cheese on white bread with cheese, lettuce and tomato"
"6744","subway, b.l.t. sub on white bread with bacon, lettuce and tomato"
"6745","fast foods, submarine sandwich, bacon, lettuce, and tomato on white bread"
"6746","fast foods, hamburger, large, single patty, with condiments"
"6747","subway, turkey breast sub on white bread with lettuce and tomato"
"6748","subway, black forest ham sub on white bread with lettuce and tomato"
"6749","subway, roast beef sub on white bread with lettuce and tomato"
"6750","subway, oven roasted chicken sub on white bread with lettuce and tomato"
"6751","subway, cold cut sub on white bread with lettuce and tomato"
"6752","subway, tuna sub on white bread with lettuce and tomato"
"6753","pizza, cheese topping, regular crust, frozen, cooked"
"6754","pizza, cheese topping, rising crust, frozen, cooked"
"6755","pizza, meat and vegetable topping, regular crust, frozen, cooked"
"6756","pizza, meat and vegetable topping, rising crust, frozen, cooked"
"6757","mcdonald's, hamburger"
"6758","fast foods, chicken, breaded and fried, boneless pieces, plain"
"6759","fast foods, crispy chicken filet sandwich, with lettuce and mayonnaise"
"6760","mcdonald's, filet-o-fish"
"6761","mcdonald's, cheeseburger"
"6762","mcdonald's, quarter pounder"
"6763","mcdonald's, quarter pounder with cheese"
"6764","mcdonald's, big mac"
"6765","mcdonald's, french fries"
"6766","wendy's, classic single hamburger, no cheese"
"6767","wendy's, classic single hamburger, with cheese"
"6768","wendy's, jr. hamburger, without cheese"
"6769","wendy's, jr. hamburger, with cheese"
"6770","wendy's, classic double, with cheese"
"6771","wendy's, homestyle chicken fillet sandwich"
"6772","wendy's, ultimate chicken grill sandwich"
"6773","wendy's, chicken nuggets"
"6774","wendy's, french fries"
"6775","wendy's, frosty dairy dessert"
"6776","burger king, french fries"
"6777","burger king, hamburger"
"6778","burger king, cheeseburger"
"6779","burger king, whopper, no cheese"
"6780","burger king, whopper, with cheese"
"6781","burger king, double whopper, no cheese"
"6782","burger king, double whopper, with cheese"
"6783","burger king, chicken strips"
"6784","burger king, premium fish sandwich"
"6785","burger king, original chicken sandwich"
"6786","taco bell, original taco with beef, cheese and lettuce"
"6787","taco bell, soft taco with beef, cheese and lettuce"
"6788","taco bell, soft taco with chicken, cheese and lettuce"
"6789","taco bell, soft taco with steak"
"6790","taco bell, bean burrito"
"6791","taco bell, burrito supreme with beef"
"6792","taco bell, burrito supreme with chicken"
"6793","taco bell, burrito supreme with steak"
"6794","taco bell, nachos"
"6795","taco bell, nachos supreme"
"6796","taco bell, taco salad"
"6797","pizza hut 12"" cheese pizza, hand-tossed crust"
"6798","pizza hut 12"" cheese pizza, pan crust"
"6799","pizza hut 12"" cheese pizza, thin 'n crispy crust"
"6800","pizza hut 12"" pepperoni pizza, hand-tossed crust"
"6801","pizza hut 12"" pepperoni pizza, pan crust"
"6802","pizza hut 12"" super supreme pizza, hand-tossed crust"
"6803","domino's 14"" cheese pizza, classic hand-tossed crust"
"6804","domino's 14"" cheese pizza, ultimate deep dish crust"
"6805","domino's 14"" cheese pizza, crunchy thin crust"
"6806","domino's 14"" pepperoni pizza, classic hand-tossed crust"
"6807","domino's 14"" pepperoni pizza, ultimate deep dish crust"
"6808","domino's 14"" extravaganzza feast pizza, classic hand-tossed crust"
"6809","papa john's 14"" cheese pizza, original crust"
"6810","papa john's 14"" pepperoni pizza, original crust"
"6811","papa john's 14"" the works pizza, original crust"
"6812","papa john's 14"" cheese pizza, thin crust"
"6813","little caesars 14"" original round cheese pizza, regular crust"
"6814","little caesars 14"" original round pepperoni pizza, regular crust"
"6815","little caesars 14"" original round meat and vegetable pizza, regular crust"
"6816","little caesars 14"" cheese pizza, large deep dish crust"
"6817","little caesars 14"" pepperoni pizza, large deep dish crust"
"6818","little caesars 14"" cheese pizza, thin crust"
"6819","pizza hut 14"" cheese pizza, hand-tossed crust"
"6820","pizza hut 14"" cheese pizza, pan crust"
"6821","pizza hut 14"" cheese pizza, thin 'n crispy crust"
"6822","pizza hut 14"" pepperoni pizza, hand-tossed crust"
"6823","pizza hut 14"" pepperoni pizza, pan crust"
"6824","pizza hut 14"" super supreme pizza, hand-tossed crust"
"6825","fast food, pizza chain, 14"" pizza, cheese topping, regular crust"
"6826","fast food, pizza chain, 14"" pizza, cheese topping, thick crust"
"6827","fast food, pizza chain, 14"" pizza, cheese topping, thin crust"
"6828","fast food, pizza chain, 14"" pizza, pepperoni topping, regular crust"
"6829","fast food, pizza chain, 14"" pizza, pepperoni topping, thick crust"
"6830","fast food, pizza chain, 14"" pizza, meat and vegetable topping, regular crust"
"6831","fast foods, griddle cake sandwich, egg, cheese, and sausage"
"6832","fast foods, griddle cake sandwich, sausage"
"6833","fast foods, griddle cake sandwich, egg, cheese, and bacon"
"6834","mcdonald's, chicken mcnuggets"
"6835","mcdonald's, barbeque sauce"
"6836","mcdonald's, creamy ranch sauce"
"6837","mcdonald's, hot mustard sauce"
"6838","mcdonald's, spicy buffalo sauce"
"6839","mcdonald's, sweet 'n sour sauce"
"6840","mcdonald's, tangy honey mustard sauce"
"6841","mcdonald's, hash brown"
"6842","mcdonald's, hotcakes (plain)"
"6843","mcdonald's, baked apple pie"
"6844","mcdonald's, bacon, egg & cheese mcgriddles"
"6845","mcdonald's, sausage mcgriddles"
"6846","mcdonald's, sausage, egg & cheese mcgriddles"
"6847","mcdonald's, vanilla reduced fat ice cream cone"
"6848","mcdonald's, strawberry sundae"
"6849","mcdonald's, hot caramel sundae"
"6850","mcdonald's, hot fudge sundae"
"6851","mcdonald's, peanuts (for sundaes)"
"6852","mcdonald's, mcflurry with m&m's candies"
"6853","mcdonald's, mcflurry with oreo cookies"
"6854","mcdonald's, sausage burrito"
"6855","mcdonald's, big breakfast"
"6856","mcdonald's, low fat caramel sauce"
"6857","mcdonald's, double cheeseburger"
"6858","mcdonald's, double quarter pounder with cheese"
"6859","mcdonald's, newman's own cobb dressing"
"6860","mcdonald's, newman's own creamy caesar dressing"
"6861","mcdonald's, newman's own low fat balsamic vinaigrette"
"6862","mcdonald's, newman's own ranch dressing"
"6863","mcdonald's, big mac (without big mac sauce)"
"6864","mcdonald's, mcchicken sandwich"
"6865","mcdonald's, mcchicken sandwich (without mayonnaise)"
"6866","mcdonald's, egg mcmuffin"
"6867","mcdonald's, sausage mcmuffin"
"6868","mcdonald's, sausage mcmuffin with egg"
"6869","mcdonald's, bacon egg & cheese biscuit"
"6870","mcdonald's, sausage biscuit"
"6871","mcdonald's, sausage biscuit with egg"
"6872","mcdonald's, deluxe breakfast, with syrup and margarine"
"6873","mcdonald's, hotcakes and sausage"
"6874","mcdonald's, hotcakes (with 2 pats margarine & syrup)"
"6875","mcdonald's, bacon ranch salad with grilled chicken"
"6876","mcdonald's bacon ranch salad with crispy chicken"
"6877","mcdonald's, bacon ranch salad without chicken"
"6878","mcdonald's, side salad"
"6879","mcdonald's, fruit 'n yogurt parfait"
"6880","mcdonald's, fruit 'n yogurt parfait (without granola)"
"6881","mcdonald's, filet-o-fish (without tartar sauce)"
"6882","burger king, croissan'wich with sausage, egg and cheese"
"6883","burger king, croissan'wich with sausage and cheese"
"6884","burger king, croissan'wich with egg and cheese"
"6885","burger king, french toast sticks"
"6886","burger king, hash brown rounds"
"6887","fast foods, miniature cinnamon rolls"
"6888","fast foods, hamburger; double, large patty; with condiments, vegetables and mayonnaise"
"6889","fast foods, hamburger; single, large patty; with condiments, vegetables and mayonnaise"
"6890","fast foods, hamburger; single, regular patty; double decker bun with condiments and special sauce"
"6891","fast foods, cheeseburger; double, regular patty; with condiments"
"6892","fast foods, cheeseburger; double, large patty; with condiments"
"6893","fast foods, cheeseburger; single, large patty; with condiments, vegetables and mayonnaise"
"6894","fast foods, cheeseburger; single, large patty; with condiments"
"6895","fast foods, cheeseburger; double, large patty; with condiments, vegetables and mayonnaise"
"6896","fast foods, cheeseburger; double, regular patty; double decker bun with condiments and special sauce"
"6897","fast foods, chicken tenders"
"6898","mcdonald's, premium grilled chicken classic sandwich"
"6899","mcdonald's, premium crispy chicken classic sandwich"
"6900","mcdonald's, premium grilled chicken club sandwich"
"6901","mcdonald's, premium crispy chicken club sandwich"
"6902","mcdonald's, premium grilled chicken ranch blt sandwich"
"6903","mcdonald's, premium crispy chicken ranch blt sandwich"
"6904","fast foods, bagel, with egg, sausage patty, cheese, and condiments"
"6905","fast foods, bagel, with breakfast steak, egg, cheese, and condiments"
"6906","light ice cream, soft serve, blended with milk chocolate candies"
"6907","light ice cream, soft serve, blended with cookie pieces"
"6908","popeyes, biscuit"
"6909","popeyes, coleslaw"
"6910","popeyes, mild chicken strips, analyzed 2006"
"6911","popeyes, spicy chicken strips, analyzed 2006"
"6912","kfc, biscuit"
"6913","kfc, coleslaw"
"6914","kfc, crispy chicken strips"
"6915","kfc, popcorn chicken"
"6916","kfc, fried chicken, original recipe, skin and breading"
"6917","kfc, fried chicken, original recipe, breast, meat only, skin and breading removed"
"6918","kfc, fried chicken, original recipe, drumstick, meat only, skin and breading removed"
"6919","kfc, fried chicken, original recipe, thigh, meat only, skin and breading removed"
"6920","kfc, fried chicken, original recipe, wing, meat only, skin and breading removed"
"6921","kfc, fried chicken, extra crispy, skin and breading"
"6922","kfc, fried chicken, extra crispy, breast, meat only, skin and breading removed"
"6923","kfc, fried chicken, extra crispy, drumstick, meat only, skin and breading removed"
"6924","kfc, fried chicken, extra crispy, thigh, meat only, skin and breading removed"
"6925","kfc, fried chicken, extra crispy, wing, meat only, skin and breading removed"
"6926","kfc, fried chicken, original recipe, breast, meat and skin with breading"
"6927","kfc, fried chicken, original recipe, drumstick, meat and skin with breading"
"6928","kfc, fried chicken, original recipe, thigh, meat and skin with breading"
"6929","kfc, fried chicken, original recipe, wing, meat and skin with breading"
"6930","kfc, fried chicken, extra crispy, breast, meat and skin with breading"
"6931","kfc, fried chicken, extra crispy, drumstick, meat and skin with breading"
"6932","kfc, fried chicken, extra crispy, thigh, meat and skin with breading"
"6933","kfc, fried chicken, extra crispy, wing, meat and skin with breading"
"6934","popeyes, fried chicken, mild, breast, meat only, skin and breading removed"
"6935","popeyes, fried chicken, mild, drumstick, meat only, skin and breading removed"
"6936","popeyes, fried chicken, mild, skin and breading"
"6937","popeyes, fried chicken, mild, thigh, meat only, skin and breading removed"
"6938","popeyes, fried chicken, mild, wing, meat only, skin and breading removed"
"6939","popeyes, fried chicken, mild, breast, meat and skin with breading"
"6940","popeyes, fried chicken, mild, drumstick, meat and skin with breading"
"6941","popeyes, fried chicken, mild, thigh, meat and skin with breading"
"6942","popeyes, fried chicken, mild, wing, meat and skin with breading"
"6943","fast foods, grilled chicken, bacon and tomato club sandwich, with cheese, lettuce, and mayonnaise"
"6944","fast foods, crispy chicken, bacon, and tomato club sandwich, with cheese, lettuce, and mayonnaise"
"6945","yogurt parfait, lowfat, with fruit and granola"
"6946","fast foods, fried chicken, breast, meat only, skin and breading removed"
"6947","fast foods, fried chicken, drumstick, meat only, skin and breading removed"
"6948","fast foods, fried chicken, thigh, meat only, skin and breading removed"
"6949","fast foods, fried chicken, wing, meat only, skin and breading removed"
"6950","fast foods, fried chicken, skin and breading from all pieces"
"6951","fast foods, fried chicken, breast, meat and skin and breading"
"6952","fast foods, fried chicken, drumstick, meat and skin with breading"
"6953","fast foods, fried chicken, thigh, meat and skin and breading"
"6954","fast foods, fried chicken, wing, meat and skin and breading"
"6955","digiorno pizza, cheese topping, cheese stuffed crust, frozen, baked"
"6956","digiorno pizza, cheese topping, rising crust, frozen, baked"
"6957","digiorno pizza, cheese topping, thin crispy crust, frozen, baked"
"6958","digiorno pizza, pepperoni topping, cheese stuffed crust, frozen, baked"
"6959","digiorno pizza, pepperoni topping, rising crust, frozen, baked"
"6960","digiorno pizza, pepperoni topping, thin crispy crust, frozen, baked"
"6961","digiorno pizza, supreme topping, rising crust, frozen, baked"
"6962","digiorno pizza, supreme topping, thin crispy crust, frozen, baked"
"6963","fast food, pizza chain, 14"" pizza, sausage topping, thick crust"
"6964","fast food, pizza chain, 14"" pizza, sausage topping, thin crust"
"6965","fast food, pizza chain, 14"" pizza, sausage topping, regular crust"
"6966","fast food, pizza chain, 14"" pizza, pepperoni topping, thin crust"
"6967","fast foods, taco with beef, cheese and lettuce, soft"
"6968","fast foods, taco with chicken, lettuce and cheese, soft"
"6969","fast foods, quesadilla, with chicken"
"6970","fast foods, grilled chicken filet sandwich, with lettuce, tomato and spread"
"6971","pizza hut 14"" pepperoni pizza, thin 'n crispy crust"
"6972","domino's 14"" pepperoni pizza, crunchy thin crust"
"6973","domino's 14"" sausage pizza, crunchy thin crust"
"6974","domino's 14"" sausage pizza, classic hand-tossed crust"
"6975","domino's 14"" sausage pizza, ultimate deep dish crust"
"6976","pizza hut 14"" sausage pizza, thin 'n crispy crust"
"6977","pizza hut 14"" sausage pizza, hand-tossed crust"
"6978","pizza hut 14"" sausage pizza, pan crust"
"6979","kashi pizza, roasted vegetable, frozen, unprepared"
"6980","kashi pizza, mushroom trio & spinach, frozen, unprepared"
"6981","kashi pizza, margherita, frozen, unprepared"
"6982","kashi pizza, mediterranean, frozen, unprepared"
"6983","pizza, cheese topping, thin crust, frozen, cooked"
"6984","burger king, double cheeseburger"
"6985","wendy's, double stack, with cheese"
"6986","wend'ys, crispy chicken sandwich"
"6987","burger king, onion rings"
"6988","wendy's, dave's hot 'n juicy 1/4 lb, single"
"6989","fast food, pizza chain, 14"" pizza, cheese topping, stuffed crust"
"6990","pizza hut 14"" cheese pizza, stuffed crust"
"6991","kashi pizza, greek tzatziki, single serve, frozen, unprepared"
"6992","kashi pizza, tikka masala, single serve, frozen, unprepared"
"6993","morningstar farms pizza, baja black bean, single serve, frozen, unprepared"
"6994","kashi pizza, mushroom and spinach, single serve, frozen, unprepared"
"6995","fast foods, crispy chicken in tortilla, with lettuce, cheese, and ranch sauce"
"6996","fast foods, grilled chicken in tortilla, with lettuce, cheese, and ranch sauce"
"6997","fast foods, breakfast burrito, with egg, cheese, and sausage"
"6998","fast foods, breadstick, soft, prepared with garlic and parmesan cheese"
"6999","fast foods, strawberry banana smoothie made with ice and low-fat yogurt"
"7000","mcdonald's, southern style chicken biscuit"
"7001","mcdonald's, ranch snack wrap, crispy"
"7002","mcdonald's, ranch snack wrap, grilled"
"7003","pizza hut, breadstick, parmesan garlic"
"7004","chick-fil-a, chicken sandwich"
"7005","arby's, roast beef sandwich, classic"
"7006","school lunch, pizza, cheese topping, thin crust, whole grain, frozen, cooked"
"7007","school lunch, pizza, cheese topping, thick crust, whole grain, frozen, cooked"
"7008","school lunch, pizza, pepperoni topping, thin crust, whole grain, frozen, cooked"
"7009","school lunch, pizza, pepperoni topping, thick crust, whole grain, frozen, cooked"
"7010","school lunch, pizza, sausage topping, thin crust, whole grain, frozen, cooked"
"7011","school lunch, pizza, sausage topping, thick crust, whole grain, frozen, cooked"
"7012","school lunch, chicken patty, whole grain breaded"
"7013","school lunch, chicken nuggets, whole grain breaded"
"7014","morningstar farms garden veggie patties, frozen, unprepared"
"7015","morningstar farms veggie dog, frozen, unprepared"
"7016","morningstar farms grillers burger style recipe crumbles, frozen, unprepared"
"7017","morningstar farms grillers vegan, frozen, unprepared"
"7018","morningstar farms breakfast sausage patties, frozen, unprepared"
"7019","morningstar farms spicy black bean burger, frozen, unprepared"
"7020","loma linda big franks, canned, unprepared"
"7021","macaroni and cheese, canned entree"
"7022","spaghetti with meat sauce, frozen entree"
"7023","beef macaroni with tomato sauce, frozen entree, reduced fat"
"7024","pasta with sliced franks in tomato sauce, canned entree"
"7025","turkey pot pie, frozen entree"
"7026","beef pot pie, frozen entree, prepared"
"7027","hot pockets, croissant pockets chicken, broccoli, and cheddar stuffed sandwich, frozen"
"7028","hot pockets ham 'n cheese stuffed sandwich, frozen"
"7029","ravioli, cheese-filled, canned"
"7030","ravioli, meat-filled, with tomato sauce or meat sauce, canned"
"7031","tortellini, pasta with cheese filling, fresh-refrigerated, as purchased"
"7032","pizza, meat topping, thick crust, frozen, cooked"
"7033","pizza, pepperoni topping, regular crust, frozen, cooked"
"7034","chili con carne with beans, canned entree"
"7035","beef stew, canned entree"
"7036","chicken pot pie, frozen entree, prepared"
"7037","beef, corned beef hash, with potato, canned"
"7038","lasagna, cheese, frozen, prepared"
"7039","chili, no beans, canned entree"
"7040","spaghetti, with meatballs in tomato sauce, canned"
"7041","pasta with tomato sauce, no meat, canned"
"7042","lasagna with meat & sauce, low-fat, frozen entree"
"7043","lasagna with meat & sauce, frozen entree"
"7044","burrito, beef and bean, frozen"
"7045","burrito, bean and cheese, frozen"
"7046","macaroni and cheese, canned, microwavable"
"7047","burrito, beef and bean, microwaved"
"7048","spaghettios, mini beef ravioli in meat sauce"
"7049","spaghettios, spaghetti in tomato & cheese sauce"
"7050","spaghettios, spaghettios original"
"7051","spaghettios, spaghettios  a to z's"
"7052","spaghettios, spaghettios in meat sauce"
"7053","spaghettios, spaghettios plus calcium"
"7054","spaghettios, spaghettios raviolios beef ravioli in meat sauce"
"7055","spaghettios, spaghettios with meatballs"
"7056","spaghettios, spaghettios with sliced franks"
"7057","spaghettios, spaghettios a to z's with meatballs"
"7058","supper bakes meal kits, cheesy chicken with pasta (chicken not included)"
"7059","supper bakes meal kits, creamy stroganoff sauce with pasta"
"7060","supper bakes meal kits, garlic chicken with pasta (chicken not included)"
"7061","supper bakes meal kits, herb chicken with rice (chicken not included)"
"7062","supper bakes meal kits, lemon chicken with herb rice (chicken not included)"
"7063","supper bakes meal kits, savory pork chops with herb stuffing (pork chop not included)"
"7064","supper bakes meal kits, southwestern-style chicken w/rice (chicken not included)"
