"","options"
"1","butter, salted"
"2","butter, whipped, with salt"
"3","butter oil, anhydrous"
"4","cheese, blue"
"5","cheese, brick"
"6","cheese, brie"
"7","cheese, camembert"
"8","cheese, caraway"
"9","cheese, cheddar"
"10","cheese, cheshire"
"11","cheese, colby"
"12","cheese, cottage, creamed, large or small curd"
"13","cheese, cottage, creamed, with fruit"
"14","cheese, cottage, nonfat, uncreamed, dry, large or small curd"
"15","cheese, cottage, lowfat, 2% milkfat"
"16","cheese, cottage, lowfat, 1% milkfat"
"17","cheese, cream"
"18","cheese, edam"
"19","cheese, feta"
"20","cheese, fontina"
"21","cheese, gjetost"
"22","cheese, gouda"
"23","cheese, gruyere"
"24","cheese, limburger"
"25","cheese, monterey"
"26","cheese, mozzarella, whole milk"
"27","cheese, mozzarella, whole milk, low moisture"
"28","cheese, mozzarella, part skim milk"
"29","cheese, mozzarella, low moisture, part-skim"
"30","cheese, muenster"
"31","cheese, neufchatel"
"32","cheese, parmesan, grated"
"33","cheese, parmesan, hard"
"34","cheese, port de salut"
"35","cheese, provolone"
"36","cheese, ricotta, whole milk"
"37","cheese, ricotta, part skim milk"
"38","cheese, romano"
"39","cheese, roquefort"
"40","cheese, swiss"
"41","cheese, tilsit"
"42","cheese, pasteurized process, american, fortified with vitamin d"
"43","cheese, pasteurized process, pimento"
"44","cheese, pasteurized process, swiss"
"45","cheese food, cold pack, american"
"46","cheese food, pasteurized process, american, vitamin d fortified"
"47","cheese food, pasteurized process, swiss"
"48","cheese spread, pasteurized process, american"
"49","cream, fluid, half and half"
"50","cream, fluid, light (coffee cream or table cream)"
"51","cream, fluid, light whipping"
"52","cream, fluid, heavy whipping"
"53","cream, whipped, cream topping, pressurized"
"54","cream, sour, reduced fat, cultured"
"55","cream, sour, cultured"
"56","eggnog"
"57","sour dressing, non-butterfat, cultured, filled cream-type"
"58","milk, filled, fluid, with blend of hydrogenated vegetable oils"
"59","milk, filled, fluid, with lauric acid oil"
"60","cheese, american, nonfat or fat free"
"61","cream substitute, liquid, with hydrogenated vegetable oil and soy protein"
"62","cream substitute, liquid, with lauric acid oil and sodium caseinate"
"63","cream substitute, powdered"
"64","dessert topping, powdered"
"65","dessert topping, powdered, 1.5 ounce prepared with 1/2 cup milk"
"66","dessert topping, pressurized"
"67","dessert topping, semi solid, frozen"
"68","sour cream, imitation, cultured"
"69","milk substitutes, fluid, with lauric acid oil"
"70","milk, whole, 3.25% milkfat, with added vitamin d"
"71","milk, producer, fluid, 3.7% milkfat"
"72","milk, reduced fat, fluid, 2% milkfat, with added vitamin a and vitamin d"
"73","milk, reduced fat, fluid, 2% milkfat, with added nonfat milk solids and vitamin a and vitamin d"
"74","milk, reduced fat, fluid, 2% milkfat, protein fortified, with added vitamin a and vitamin d"
"75","milk, lowfat, fluid, 1% milkfat, with added vitamin a and vitamin d"
"76","milk, lowfat, fluid, 1% milkfat, with added nonfat milk solids, vitamin a and vitamin d"
"77","milk, lowfat, fluid, 1% milkfat, protein fortified, with added vitamin a and vitamin d"
"78","milk, nonfat, fluid, with added vitamin a and vitamin d (fat free or skim)"
"79","milk, nonfat, fluid, with added nonfat milk solids, vitamin a and vitamin d (fat free or skim)"
"80","milk, nonfat, fluid, protein fortified, with added vitamin a and vitamin d (fat free and skim)"
"81","milk, buttermilk, fluid, cultured, lowfat"
"82","milk, low sodium, fluid"
"83","milk, dry, whole, with added vitamin d"
"84","milk, dry, nonfat, regular, without added vitamin a and vitamin d"
"85","milk, dry, nonfat, instant, with added vitamin a and vitamin d"
"86","milk, dry, nonfat, calcium reduced"
"87","milk, buttermilk, dried"
"88","milk, canned, condensed, sweetened"
"89","milk, canned, evaporated, with added vitamin d and without added vitamin a"
"90","milk, canned, evaporated, nonfat, with added vitamin a and vitamin d"
"91","milk, chocolate, fluid, commercial, whole, with added vitamin a and vitamin d"
"92","milk, chocolate, fluid, commercial, reduced fat, with added vitamin a and vitamin d"
"93","milk, chocolate, lowfat, with added vitamin a and vitamin d"
"94","milk, chocolate beverage, hot cocoa, homemade"
"95","milk, goat, fluid, with added vitamin d"
"96","milk, human, mature, fluid"
"97","milk, indian buffalo, fluid"
"98","milk, sheep, fluid"
"99","milk shakes, thick chocolate"
"100","milk shakes, thick vanilla"
"101","whey, acid, fluid"
"102","whey, acid, dried"
"103","whey, sweet, fluid"
"104","whey, sweet, dried"
"105","yogurt, plain, whole milk, 8 grams protein per 8 ounce"
"106","yogurt, plain, low fat, 12 grams protein per 8 ounce"
"107","yogurt, plain, skim milk, 13 grams protein per 8 ounce"
"108","yogurt, vanilla, low fat, 11 grams protein per 8 ounce"
"109","yogurt, fruit, low fat, 9 grams protein per 8 ounce"
"110","yogurt, fruit, low fat, 10 grams protein per 8 ounce"
"111","yogurt, fruit, low fat, 11 grams protein per 8 ounce"
"112","egg, whole, raw, fresh"
"113","egg, white, raw, fresh"
"114","egg, yolk, raw, fresh"
"115","egg, yolk, raw, frozen, pasteurized"
"116","egg, yolk, raw, frozen, sugared, pasteurized"
"117","egg, whole, cooked, fried"
"118","egg, whole, cooked, hard-boiled"
"119","egg, whole, cooked, omelet"
"120","egg, whole, cooked, poached"
"121","egg, whole, cooked, scrambled"
"122","egg, whole, dried"
"123","egg, whole, dried, stabilized, glucose reduced"
"124","egg, white, dried, flakes, stabilized, glucose reduced"
"125","egg, white, dried, powder, stabilized, glucose reduced"
"126","egg, yolk, dried"
"127","egg, duck, whole, fresh, raw"
"128","egg, goose, whole, fresh, raw"
"129","egg, quail, whole, fresh, raw"
"130","egg, turkey, whole, fresh, raw"
"131","egg substitute, powder"
"132","butter, without salt"
"133","cheese, parmesan, shredded"
"134","milk, nonfat, fluid, without added vitamin a and vitamin d (fat free or skim)"
"135","milk, reduced fat, fluid, 2% milkfat, with added nonfat milk solids, without added vitamin a"
"136","milk, canned, evaporated, with added vitamin a"
"137","milk, dry, nonfat, regular, with added vitamin a and vitamin d"
"138","milk, dry, nonfat, instant, without added vitamin a and vitamin d"
"139","cheese, goat, hard type"
"140","cheese, goat, semisoft type"
"141","cheese, goat, soft type"
"142","egg, yolk, raw, frozen, salted, pasteurized"
"143","cheese substitute, mozzarella"
"144","cheese sauce, prepared from recipe"
"145","cheese, mexican, queso anejo"
"146","cheese, mexican, queso asadero"
"147","cheese, mexican, queso chihuahua"
"148","cheese, low fat, cheddar or colby"
"149","cheese, low-sodium, cheddar or colby"
"150","egg, whole, raw, frozen, pasteurized"
"151","egg, white, raw, frozen, pasteurized"
"152","egg, white, dried"
"153","milk, reduced fat, fluid, 2% milkfat, without added vitamin a and vitamin d"
"154","milk, fluid, 1% fat, without added vitamin a and vitamin d"
"155","sour cream, reduced fat"
"156","sour cream, light"
"157","sour cream, fat free"
"158","usda commodity, cheese, cheddar, reduced fat"
"159","yogurt, vanilla or lemon flavor, nonfat milk, sweetened with low-calorie sweetener"
"160","parmesan cheese topping, fat free"
"161","cheese, cream, fat free"
"162","yogurt, chocolate, nonfat milk"
"163","kraft cheez whiz pasteurized process cheese sauce"
"164","kraft cheez whiz light pasteurized process cheese product"
"165","kraft free singles american nonfat pasteurized process cheese product"
"166","kraft velveeta pasteurized process cheese spread"
"167","kraft velveeta light reduced fat pasteurized process cheese product"
"168","kraft breakstone's reduced fat sour cream"
"169","kraft breakstone's free fat free sour cream"
"170","cream, half and half, fat free"
"171","reddi wip fat free whipped topping"
"172","milk, chocolate, fluid, commercial, reduced fat, with added calcium"
"173","yogurt, fruit, lowfat, with low calorie sweetener"
"174","cheese, parmesan, dry grated, reduced fat"
"175","cream substitute, flavored, liquid"
"176","cream substitute, flavored, powdered"
"177","cheese, provolone, reduced fat"
"178","cheese, mexican, blend, reduced fat"
"179","egg mix, usda commodity"
"180","milk, whole, 3.25% milkfat, without added vitamin a and vitamin d"
"181","milk, dry, whole, without added vitamin d"
"182","milk, canned, evaporated, without added vitamin a and vitamin d"
"183","cheese product, pasteurized process, american, reduced fat, fortified with vitamin d"
"184","yogurt, fruit, low fat, 9 grams protein per 8 ounce, fortified with vitamin d"
"185","yogurt, fruit, low fat, 10 grams protein per 8 ounce, fortified with vitamin d"
"186","yogurt, fruit variety, nonfat, fortified with vitamin d"
"187","yogurt, fruit, lowfat, with low calorie sweetener, fortified with vitamin d"
"188","yogurt, vanilla, low fat, 11 grams protein per 8 ounce, fortified with vitamin d"
"189","yogurt, vanilla or lemon flavor, nonfat milk, sweetened with low-calorie sweetener, fortified with vitamin d"
"190","yogurt, chocolate, nonfat milk, fortified with vitamin d"
"191","protein supplement, milk based, muscle milk, powder"
"192","protein supplement, milk based, muscle milk light, powder"
"193","dulce de leche"
"194","egg substitute, liquid or frozen, fat free"
"195","cheese, dry white, queso seco"
"196","cheese, fresh, queso fresco"
"197","cheese, white, queso blanco"
"198","milk, buttermilk, fluid, whole"
"199","yogurt, vanilla flavor, lowfat milk, sweetened with low calorie sweetener"
"200","yogurt, frozen, flavors not chocolate, nonfat milk, with low-calorie sweetener"
"201","ice cream, soft serve, chocolate"
"202","ice cream, bar or stick, chocolate covered"
"203","ice cream sandwich"
"204","ice cream cookie sandwich"
"205","ice cream cone, chocolate covered, with nuts, flavors other than chocolate"
"206","ice cream sandwich, made with light ice cream, vanilla"
"207","ice cream sandwich, vanilla, light, no sugar added"
"208","fat free ice cream, no sugar added, flavors other than chocolate"
"209","milk dessert bar, frozen, made from lowfat milk"
"210","nutritional supplement for people with diabetes, liquid"
"211","cheese, mexican blend"
"212","cheese product, pasteurized process, american, vitamin d fortified"
"213","cheese, pasteurized process, american, without added vitamin d"
"214","cheese food, pasteurized process, american, without added vitamin d"
"215","egg, whole, raw, frozen, salted, pasteurized"
"216","yogurt, greek, plain, nonfat"
"217","egg, white, dried, stabilized, glucose reduced"
"218","cheese spread, american or cheddar cheese base, reduced fat"
"219","cheese, cheddar, reduced fat"
"220","ice cream, light, soft serve, chocolate"
"221","ice cream bar, stick or nugget, with crunch coating"
"222","cheese, cheddar, nonfat or fat free"
"223","cheese, swiss, nonfat or fat free"
"224","cheese, mexican, queso cotija"
"225","cheese, cheddar, sharp, sliced"
"226","cheese, mozzarella, low moisture, part-skim, shredded"
"227","yogurt, greek, nonfat, vanilla, chobani"
"228","yogurt, greek, strawberry, dannon oikos"
"229","yogurt, greek, nonfat, vanilla, dannon oikos"
"230","yogurt, greek, nonfat, strawberry, dannon oikos"
"231","yogurt, greek, nonfat, strawberry, chobani"
"232","yogurt, greek, strawberry, lowfat"
"233","yogurt, greek, strawberry, nonfat"
"234","yogurt, greek, vanilla, nonfat"
"235","yogurt, greek, plain, lowfat"
"236","kefir, lowfat, plain, lifeway"
"237","kefir, lowfat, strawberry, lifeway"
"238","milk, evaporated, 2% fat, with added vitamin a and vitamin d"
"239","milk, chocolate, fat free, with added vitamin a and vitamin d"
"240","yogurt, greek, plain, whole milk"
"241","yogurt, greek, fruit, whole milk"
"242","yogurt, vanilla, non-fat"
"243","yogurt, greek, vanilla, lowfat"
"244","yogurt, frozen, flavors other than chocolate, lowfat"
"245","ice cream bar, covered with chocolate and nuts"
"246","ice cream sundae cone"
"247","light ice cream, creamsicle"
"248","cream, half and half, lowfat"
"249","milk, chocolate, lowfat, reduced sugar"
"250","ice cream, lowfat, no sugar added, cone, added peanuts and chocolate sauce"
"251","spices, allspice, ground"
"252","spices, anise seed"
"253","spices, basil, dried"
"254","spices, bay leaf"
"255","spices, caraway seed"
"256","spices, cardamom"
"257","spices, celery seed"
"258","spices, chervil, dried"
"259","spices, chili powder"
"260","spices, cinnamon, ground"
"261","spices, cloves, ground"
"262","spices, coriander leaf, dried"
"263","spices, coriander seed"
"264","spices, cumin seed"
"265","spices, curry powder"
"266","spices, dill seed"
"267","spices, dill weed, dried"
"268","spices, fennel seed"
"269","spices, fenugreek seed"
"270","spices, garlic powder"
"271","spices, ginger, ground"
"272","spices, mace, ground"
"273","spices, marjoram, dried"
"274","spices, mustard seed, ground"
"275","spices, nutmeg, ground"
"276","spices, onion powder"
"277","spices, oregano, dried"
"278","spices, paprika"
"279","spices, parsley, dried"
"280","spices, pepper, black"
"281","spices, pepper, red or cayenne"
"282","spices, pepper, white"
"283","spices, poppy seed"
"284","spices, poultry seasoning"
"285","spices, pumpkin pie spice"
"286","spices, rosemary, dried"
"287","spices, saffron"
"288","spices, sage, ground"
"289","spices, savory, ground"
"290","spices, tarragon, dried"
"291","spices, thyme, dried"
"292","spices, turmeric, ground"
"293","basil, fresh"
"294","dill weed, fresh"
"295","mustard, prepared, yellow"
"296","salt, table"
"297","vinegar, cider"
"298","thyme, fresh"
"299","vanilla extract"
"300","vanilla extract, imitation, alcohol"
"301","vanilla extract, imitation, no alcohol"
"302","vinegar, distilled"
"303","capers, canned"
"304","horseradish, prepared"
"305","rosemary, fresh"
"306","peppermint, fresh"
"307","spearmint, fresh"
"308","spearmint, dried"
"309","vinegar, red wine"
"310","vinegar, balsamic"
"311","pace, dry taco seasoning mix"
"312","seasoning mix, dry, sazon, coriander & annatto"
"313","seasoning mix, dry, taco, original"
"314","seasoning mix, dry, chili, original"
"315","clif z bar"
"316","babyfood, juice treats, fruit medley, toddler"
"317","babyfood, meat, beef, strained"
"318","babyfood, meat, beef, junior"
"319","babyfood, meat, veal, strained"
"320","babyfood, meat, pork, strained"
"321","babyfood, meat, ham, strained"
"322","babyfood, meat, ham, junior"
"323","babyfood, meat, lamb, strained"
"324","babyfood, meat, lamb, junior"
"325","babyfood, meat, chicken, strained"
"326","babyfood, meat, chicken, junior"
"327","babyfood, meat, chicken sticks, junior"
"328","babyfood, meat, turkey, strained"
"329","babyfood, meat, turkey, junior"
"330","babyfood, meat, turkey sticks, junior"
"331","babyfood, snack, gerber graduate fruit  strips, real fruit bars"
"332","babyfood, meat, meat sticks, junior"
"333","babyfood, gerber, 2nd foods, apple, carrot and squash, organic"
"334","finger snacks, gerber graduate puffs, apple and cinnamon"
"335","babyfood, water, bottled, gerber, without added fluoride."
"336","babyfood, gerber, 3rd foods, apple, mango and kiwi"
"337","babyfood, tropical fruit medley"
"338","babyfood, dinner, vegetables and dumplings and beef, strained"
"339","babyfood, dinner, vegetables and dumplings and beef, junior"
"340","babyfood, dinner, beef lasagna, toddler"
"341","babyfood, dinner, macaroni and tomato and beef, strained"
"342","babyfood, dinner, macaroni and tomato and beef, junior"
"343","babyfood, ravioli, cheese filled, with tomato sauce"
"344","babyfood, dinner, beef noodle, strained"
"345","babyfood, macaroni and cheese, toddler"
"346","babyfood, dinner, beef and rice, toddler"
"347","babyfood, dinner, spaghetti and tomato and meat, junior"
"348","babyfood, dinner, spaghetti and tomato and meat, toddler"
"349","babyfood, dinner, beef stew, toddler"
"350","babyfood, dinner, vegetables and beef, strained"
"351","babyfood, dinner, vegetables and beef, junior"
"352","babyfood, dinner, beef with vegetables"
"353","babyfood, dinner, vegetables and bacon, strained"
"354","babyfood, dinner, vegetables and ham, strained"
"355","babyfood, dinner, vegetables and ham, junior"
"356","babyfood, dinner, vegetables and lamb, strained"
"357","babyfood, dinner, vegetables and lamb, junior"
"358","babyfood, dinner, chicken noodle, strained"
"359","babyfood, dinner, chicken noodle, junior"
"360","babyfood, dinner, chicken soup, strained"
"361","babyfood, dinner, chicken stew, toddler"
"362","babyfood, dinner, vegetables chicken, strained"
"363","babyfood, dinner, vegetables, noodles and chicken, strained"
"364","babyfood, dinner, vegetables, noodles and chicken, junior"
"365","babyfood, dinner, pasta with vegetables"
"366","babyfood, dinner, vegetables and noodles and turkey, strained"
"367","babyfood, dinner, vegetables and noodles and turkey, junior"
"368","babyfood, dinner, turkey and rice, strained"
"369","babyfood, dinner, turkey and rice, junior"
"370","babyfood, dinner, vegetables and turkey, strained"
"371","babyfood, dinner, vegetables and turkey, junior"
"372","babyfood, dinner, macaroni and cheese, strained"
"373","babyfood, dinner, macaroni and cheese, junior"
"374","babyfood, vegetables, green beans, strained"
"375","babyfood, vegetables, green beans, junior"
"376","babyfood, green beans, dices, toddler"
"377","babyfood, vegetable, green beans and potatoes"
"378","babyfood, vegetables, beets, strained"
"379","babyfood, vegetables, carrots, strained"
"380","babyfood, vegetables, carrots, junior"
"381","babyfood, vegetables, squash, strained"
"382","babyfood, vegetables, squash, junior"
"383","babyfood, vegetables, sweet potatoes strained"
"384","babyfood, vegetables, sweet potatoes, junior"
"385","babyfood, potatoes, toddler"
"386","babyfood, vegetable, butternut squash and corn"
"387","babyfood, apples, dices, toddler"
"388","babyfood, fruit, applesauce, strained"
"389","babyfood, fruit, applesauce, junior"
"390","babyfood, fruit, apricot with tapioca, strained"
"391","babyfood, vegetables, corn, creamed, strained"
"392","babyfood, vegetables, corn, creamed, junior"
"393","babyfood, vegetables, peas, strained"
"394","babyfood, peas, dices, toddler"
"395","babyfood, vegetables, spinach, creamed, strained"
"396","babyfood, fruit, apricot with tapioca, junior"
"397","babyfood, fruit, bananas with tapioca, strained"
"398","babyfood, fruit, peaches, strained"
"399","babyfood, fruit, peaches, junior"
"400","babyfood, fruit, pears, strained"
"401","babyfood, fruit, pears, junior"
"402","babyfood, fruit, plums with tapioca, without ascorbic acid, strained"
"403","babyfood, fruit, plums with tapioca, without ascorbic acid, junior"
"404","babyfood, fruit, prunes with tapioca, without ascorbic acid, strained"
"405","babyfood, fruit, prunes with tapioca, without ascorbic acid, junior"
"406","babyfood, prunes, without vitamin c, strained"
"407","babyfood, fruit dessert, mango with tapioca"
"408","babyfood, pears, dices, toddler"
"409","babyfood, fruit, applesauce and apricots, strained"
"410","babyfood, fruit, applesauce and apricots, junior"
"411","babyfood, fruit, applesauce and cherries, strained"
"412","babyfood, fruit, applesauce and cherries, junior"
"413","babyfood, fruit, applesauce with banana, junior"
"414","babyfood, fruit, applesauce and pineapple, strained"
"415","babyfood, fruit, applesauce and pineapple, junior"
"416","babyfood, fruit, apple and raspberry, strained"
"417","babyfood, fruit, apple and raspberry, junior"
"418","babyfood, fruit and vegetable, apple and sweet potato"
"419","babyfood, fruit, bananas and pineapple with tapioca, junior"
"420","babyfood, fruit, bananas and pineapple with tapioca, strained"
"421","babyfood, fruit, pears and pineapple, strained"
"422","babyfood, fruit, pears and pineapple, junior"
"423","babyfood, fruit, guava and papaya with tapioca, strained"
"424","babyfood, peaches, dices, toddler"
"425","babyfood, fruit, papaya and applesauce with tapioca, strained"
"426","babyfood, fruit, bananas with apples and pears, strained"
"427","babyfood, fruit, apple and blueberry, strained"
"428","babyfood, fruit, apple and blueberry, junior"
"429","babyfood, juice, apple"
"430","babyfood, apple-banana juice"
"431","babyfood, juice, apple and peach"
"432","babyfood, apple-cranberry juice"
"433","babyfood, juice, apple and plum"
"434","babyfood, juice, apple and prune"
"435","babyfood, juice, orange"
"436","babyfood, juice, orange and apple"
"437","babyfood, juice, orange and apple and banana"
"438","babyfood, juice, orange and apricot"
"439","babyfood, juice, orange and banana"
"440","babyfood, juice, orange and pineapple"
"441","babyfood, juice, prune and orange"
"442","babyfood, juice, mixed fruit"
"443","babyfood, cereal, barley, dry fortified"
"444","babyfood, cereal, whole wheat, with apples, dry fortified"
"445","babyfood, cereal, mixed, dry fortified"
"446","babyfood, cereal, mixed, with bananas, dry"
"447","babyfood, cereal, mixed, with applesauce and bananas, strained"
"448","babyfood, cereal, mixed, with applesauce and bananas, junior"
"449","babyfood, cereal, oatmeal, dry fortified"
"450","babyfood, cereal, oatmeal, with bananas, dry"
"451","babyfood, cereal, oatmeal, with applesauce and bananas, strained"
"452","babyfood, cereal, oatmeal, with applesauce and bananas, junior"
"453","babyfood, cereal, oatmeal, with honey, dry"
"454","babyfood, cereal, rice, dry fortified"
"455","babyfood, cereal, rice, with applesauce and bananas, strained"
"456","babyfood, cereal, with egg yolks, strained"
"457","babyfood, cereal, with egg yolks, junior"
"458","babyfood, cereal, with eggs, strained"
"459","babyfood, cereal, egg yolks and bacon, junior"
"460","babyfood, oatmeal cereal with fruit, dry, instant, toddler fortified"
"461","babyfood, cookie, baby, fruit"
"462","babyfood, crackers, vegetable"
"463","babyfood, cereal, high protein, with apple and orange, dry"
"464","babyfood, cereal, rice, with bananas, dry"
"465","babyfood, cookies"
"466","babyfood, cookies, arrowroot"
"467","babyfood, pretzels"
"468","babyfood, teething biscuits"
"469","zwieback"
"470","babyfood, dessert, dutch apple, strained"
"471","babyfood, dessert, dutch apple, junior"
"472","babyfood, cherry cobbler, junior"
"473","babyfood, dessert, cherry vanilla pudding, strained"
"474","babyfood, dessert, cherry vanilla pudding, junior"
"475","babyfood, dessert, fruit pudding, orange, strained"
"476","babyfood, dessert, peach cobbler, strained"
"477","babyfood, dessert, peach cobbler, junior"
"478","babyfood, dessert, peach melba, strained"
"479","babyfood, dessert, peach melba, junior"
"480","babyfood, dessert, fruit pudding, pineapple, strained"
"481","babyfood, dessert, fruit dessert, without ascorbic acid, strained"
"482","babyfood, dessert, fruit dessert, without ascorbic acid, junior"
"483","babyfood, dessert, tropical fruit, junior"
"484","babyfood, dessert, custard pudding, vanilla, strained"
"485","babyfood, dessert, custard pudding, vanilla, junior"
"486","babyfood, juice, apple and grape"
"487","babyfood, juice, fruit punch, with calcium"
"488","babyfood, juice, apple and cherry"
"489","babyfood, juice, apple, with calcium"
"490","babyfood, dinner, vegetables and chicken, junior"
"491","babyfood, dinner, mixed vegetable, strained"
"492","babyfood, dinner, mixed vegetable, junior"
"493","babyfood, fruit, bananas with tapioca, junior"
"494","babyfood, vegetables, mix vegetables junior"
"495","babyfood, vegetables, garden vegetable, strained"
"496","babyfood, vegetables, mix vegetables strained"
"497","babyfood, dinner, beef noodle, junior"
"498","babyfood, apples with ham, strained"
"499","babyfood, carrots and beef, strained"
"500","babyfood, plums, bananas and rice, strained"
"501","babyfood, dinner, turkey, rice, and vegetables, toddler"
"502","babyfood, dinner, apples and chicken, strained"
"503","babyfood, dinner, broccoli and chicken, junior"
"504","babyfood, beverage, gerber graduate fruit splashers"
"505","babyfood, snack, gerber graduate yogurt melts"
"506","babyfood, dinner, sweet potatoes and chicken, strained"
"507","babyfood, dinner, potatoes with cheese and ham, toddler"
"508","babyfood, cereal, barley, prepared with whole milk"
"509","babyfood, cereal, high protein, prepared with whole milk"
"510","babyfood, cereal, mixed, prepared with whole milk"
"511","babyfood, cereal, mixed, with bananas, prepared with whole milk"
"512","babyfood, cereal, oatmeal, prepared with whole milk"
"513","babyfood, cereal, oatmeal, with bananas, prepared with whole milk"
"514","babyfood, cereal, oatmeal, with honey, prepared with whole milk"
"515","babyfood, cereal, rice, prepared with whole milk"
"516","babyfood, cereal, rice, with honey, prepared with whole milk"
"517","babyfood, cereal, mixed, with honey, prepared with whole milk"
"518","babyfood, cereal, high protein, with apple and orange, prepared with whole milk"
"519","babyfood, cereal, rice, with bananas, prepared with whole milk"
"520","infant formula, nestle, good start supreme, with iron, ready-to-feed"
"521","infant formula, nestle, good start supreme, with iron, liquid concentrate, not reconstituted"
"522","infant formula, nestle, good start supreme, with iron, powder"
"523","infant formula, mead johnson, enfamil, with iron, ready-to-feed"
"524","infant formula, mead johnson, enfamil, with iron, powder"
"525","infant formula, mead johnson, enfamil, low iron, ready-to-feed"
"526","infant formula, mead johnson, enfamil, lipil, with iron, powder, with ara and dha"
"527","infant formula, mead johnson, enfamil, low iron, powder, not reconstituted"
"528","infant formula, mead johnson, enfamil, lipil, with iron, liquid concentrate, with ara and dha"
"529","infant formula, mead johnson, enfamil, nutramigen, with iron, ready-to-feed"
"530","infant formula, mead johnson, enfamil, nutramigen, with iron, powder, not reconstituted"
